[
  {
    "id": "drukhari",
    "name": "Drukhari",
    "parent_faction_id": null,
    "game_version": {
      "edition": "11th",
      "dataslate": "pre-launch-provisional"
    },
    "keywords": [
      "Aeldari",
      "Drukhari"
    ],
    "aliases": [],
    "logo_url": "https://cdn.jsdelivr.net/gh/Certseeds/wh40k-icon@be230023ff0755d19ffb1a1762658c711c2887f9/src/svgs/xenos/durhkari/drukhari-2.svg",
    "external_refs": [
      {
        "namespace": "game-datacards",
        "id": "43bbfe97-4c14-47be-be2b-90de3e6756b1"
      },
      {
        "namespace": "mfm",
        "id": "43bbfe97-4c14-47be-be2b-90de3e6756b1"
      }
    ],
    "faction_rule_ids": [
      "power-from-pain-drukhari",
      "corsairs-and-travelling-players-drukhari"
    ],
    "keyword_limits": [
      {
        "keywords": [
          "Death Jester"
        ],
        "max": 1
      },
      {
        "keywords": [
          "Shadowseer"
        ],
        "max": 1
      },
      {
        "keywords": [
          "Troupe Master"
        ],
        "max": 1
      }
    ]
  }
]
