[
  {
    "id": "black-templars",
    "name": "Black Templars",
    "parent_faction_id": "adeptus-astartes",
    "game_version": {
      "edition": "11th",
      "dataslate": "pre-launch-provisional"
    },
    "keywords": [
      "Imperium",
      "Adeptus Astartes",
      "Black Templars"
    ],
    "aliases": [],
    "logo_url": "https://cdn.jsdelivr.net/gh/Certseeds/wh40k-icon@be230023ff0755d19ffb1a1762658c711c2887f9/src/svgs/human_imperium/astartes_chapters/black-templars.svg",
    "external_refs": [
      {
        "namespace": "game-datacards",
        "id": "28162de0-fd36-450b-87ee-39e973ead32d"
      },
      {
        "namespace": "mfm",
        "id": "28162de0-fd36-450b-87ee-39e973ead32d"
      }
    ],
    "faction_rule_ids": [
      "combat-doctrines-black-templars",
      "transhuman-strategist-black-templars",
      "heirs-of-sigismund-black-templars"
    ],
    "army_construction_rules": [
      {
        "type": "faction-keyword-cohesion",
        "base_faction_keyword": "Adeptus Astartes",
        "additional_keyword_source": "chapter",
        "max_distinct": 1
      }
    ],
    "keyword_limits": [
      {
        "keywords": [
          "Emperor’s Champion"
        ],
        "max": 1
      }
    ]
  }
]
