[
  {
    "id": "ultramarines",
    "name": "Ultramarines",
    "parent_faction_id": "adeptus-astartes",
    "game_version": {
      "edition": "11th",
      "dataslate": "pre-launch-provisional"
    },
    "keywords": [
      "Imperium",
      "Adeptus Astartes",
      "Ultramarines"
    ],
    "aliases": [],
    "logo_url": "https://cdn.jsdelivr.net/gh/Certseeds/wh40k-icon@be230023ff0755d19ffb1a1762658c711c2887f9/src/svgs/human_imperium/astartes_legion/ultramarines.svg",
    "external_refs": [
      {
        "namespace": "mfm",
        "id": "b7d67027-cf56-4cd1-8127-9e7658de4ef5"
      }
    ],
    "faction_rule_ids": [
      "combat-doctrines-adeptus-astartes",
      "transhuman-strategist-adeptus-astartes",
      "librarius-adeptus-astartes",
      "special-move-types-adeptus-astartes"
    ],
    "army_construction_rules": [
      {
        "type": "faction-keyword-cohesion",
        "base_faction_keyword": "Adeptus Astartes",
        "additional_keyword_source": "chapter",
        "max_distinct": 1
      }
    ],
    "keyword_limits": [
      {
        "keywords": [
          "Marneus Calgar"
        ],
        "max": 1
      },
      {
        "keywords": [
          "Sicarius"
        ],
        "max": 1
      }
    ]
  }
]
