[
  {
    "id": "aeldari",
    "name": "Aeldari",
    "parent_faction_id": null,
    "game_version": {
      "edition": "11th",
      "dataslate": "pre-launch-provisional"
    },
    "keywords": [
      "Aeldari",
      "Asuryani"
    ],
    "aliases": [],
    "logo_url": "https://cdn.jsdelivr.net/gh/Certseeds/wh40k-icon@be230023ff0755d19ffb1a1762658c711c2887f9/src/svgs/xenos/eldar/craftworld-eldar.svg",
    "external_refs": [
      {
        "namespace": "game-datacards",
        "id": "2cb72f92-bfc7-4d2c-a183-b2bff6b26bfc"
      },
      {
        "namespace": "mfm",
        "id": "ac535854-d25c-4bc3-aacf-129ab0ae75d7"
      }
    ],
    "faction_rule_ids": [
      "battle-focus-aeldari",
      "disparate-paths-aeldari"
    ],
    "keyword_limits": [
      {
        "keywords": [
          "Death Jester"
        ],
        "max": 1
      },
      {
        "keywords": [
          "Epic Hero",
          "The Visarch"
        ],
        "max": 0,
        "exempt_faction_keywords": [
          "Ynnari"
        ]
      },
      {
        "keywords": [
          "Epic Hero",
          "The Yncarne"
        ],
        "max": 0,
        "exempt_faction_keywords": [
          "Ynnari"
        ]
      },
      {
        "keywords": [
          "Epic Hero",
          "Yvraine"
        ],
        "max": 0,
        "exempt_faction_keywords": [
          "Ynnari"
        ]
      },
      {
        "keywords": [
          "Shadowseer"
        ],
        "max": 1
      },
      {
        "keywords": [
          "Troupe Master"
        ],
        "max": 1
      }
    ]
  }
]
